{
  "benchmark_id": "single_qubit_gate_cancellation",
  "commit_sha": "b6274990c98af3abf7c03d146bfd1773957117ae",
  "reviewer": "rkothari-formal",
  "reviewer_role": "formal_evidence",
  "reviewed_artifacts": [
    "spec.yaml"
  ],
  "commands_executed": [
    "qspecbench validate"
  ],
  "accepted_obligations": [],
  "rejected_obligations": [],
  "residual_assumptions": [
    "full_openqasm3",
    "hardware_semantics"
  ],
  "conflict_of_interest": {
    "is_author": false,
    "is_merging_maintainer": false
  },
  "decision": "approved",
  "signature": "unsigned-corpus-v0.3-rkothari-formal",
  "proposition_id": "single_qubit_gate_cancellation_v1"
}
