{
  "benchmark_id": "teleportation_preserves_state_up_to_pauli_correction",
  "commit_sha": "b6274990c98af3abf7c03d146bfd1773957117ae",
  "reviewer": "rkothari-formal",
  "reviewer_role": "formal_evidence",
  "reviewed_artifacts": [
    "spec.yaml",
    "expected/semantic_bridge.json",
    "artifacts/teleport_unitary_prefix.qasm"
  ],
  "commands_executed": [
    "qspecbench validate",
    "qspecbench verify-bridge",
    "qspecbench bridge-metadata verify"
  ],
  "accepted_obligations": [
    "unitary_fragment_matches_ordering",
    "semantic_bridge"
  ],
  "rejected_obligations": [],
  "residual_assumptions": [
    "full_openqasm_dynamic_circuit_protocol",
    "hardware_semantics",
    "classical_feed_forward_operational_semantics"
  ],
  "conflict_of_interest": {
    "is_author": false,
    "is_merging_maintainer": false
  },
  "decision": "approved",
  "signature": "unsigned-corpus-v0.3-rkothari-formal",
  "proposition_id": "teleportation_preserves_state_up_to_pauli_correction_v2"
}
